{
  "schema": "atlas.inventory/v1",
  "id": "INV-DEMO-1",
  "scope_note": "All entities belong to a synthetic example, not a real project",
  "source_ref": "synthetic-fixture",
  "observed_at": "2026-10-17T03:00:00Z",
  "domains": [
    {
      "id": "goals",
      "title": "goals",
      "exhaustive": true,
      "items": [
        "G-LIMIT"
      ],
      "exclusions": []
    },
    {
      "id": "modules",
      "title": "modules",
      "exhaustive": true,
      "items": [
        "MOD-BATCH"
      ],
      "exclusions": []
    },
    {
      "id": "contracts",
      "title": "contracts",
      "exhaustive": true,
      "items": [
        "API-BATCH-v1"
      ],
      "exclusions": []
    },
    {
      "id": "documents",
      "title": "documents",
      "exhaustive": true,
      "items": [
        "DOC-PROJECT",
        "DOC-CONTRACT",
        "DOC-PATCH"
      ],
      "exclusions": []
    },
    {
      "id": "source",
      "title": "source",
      "exhaustive": true,
      "items": [
        "SRC-BATCH"
      ],
      "exclusions": []
    },
    {
      "id": "works",
      "title": "works",
      "exhaustive": true,
      "items": [
        "W-01",
        "W-02",
        "W-03"
      ],
      "exclusions": []
    }
  ]
}
